[
  {
    "title": "M.S. Computer Science",
    "category": "education",
    "organization": "Washington University in St. Louis",
    "location": "St. Louis, Missouri, USA",
    "role_context": null,
    "start_date": "2024-08-01",
    "end_date": "2026-05-31",
    "responsibilities": [
      "GPA: 3.67/4.00.",
      "Thesis: Toward Vehicle-Agnostic Driving Signatures for Cognitive Impairment Prediction from Naturalistic Driving Data — defended April 2026 and published in the McKelvey School of Engineering Graduate Student Theses & Dissertations (Thesis Advisor & Committee Chair: Dr. Alvitta Ottley; Thesis Supervisor & DRIVES Lab PI: Dr. Ganesh Babulal).",
      "Coursework: Data Manipulation & Management at Scale, Advances in Computer Vision, Deep Reinforcement Learning, Bayesian Methods in Machine Learning, AI for Health, Algorithms for Computational Biology, Systems Security, Quantum Computing, Rapid Prototype Development, and Cognitive & Systems Neuroscience.",
      "Highlights: master's thesis with the DRIVES Project; Vice President of the GPSC's GPC Chamber; Graduate Assistant with the Taylor Family Center for Student Success; Graduate TA for CSE 5114; AI engineering internship at Crittero, Inc."
    ],
    "related_projects": [],
    "links": [
      {
        "label": "Master's Thesis — WashU Open Scholarship",
        "url": "https://openscholarship.wustl.edu/eng_etds/1341/",
        "type": "publication"
      }
    ],
    "has_detail": true,
    "id": "2024-08-m-s-computer-science",
    "excerpt": "M.S. in Computer Science at WashU's McKelvey School of Engineering (GPA 3.67/4.00), capped by a master's thesis on predicting cognitive impairment from naturalistic driving data."
  },
  {
    "title": "B.A. Computer Science & Data Analytics",
    "category": "education",
    "organization": "Ohio Wesleyan University",
    "location": "Delaware, Ohio, USA",
    "role_context": null,
    "start_date": "2020-08-01",
    "end_date": "2023-05-31",
    "responsibilities": [
      "Double major in Computer Science and Data Analytics with an Economics minor; completed the four-year program in three years (GPA: 3.42/4.00).",
      "Capstone: Opinion Survey on Artificial Intelligence in the Workplace — a DATA 490 independent study mentored by Dr. Nicholas Dietrich.",
      "Coursework: Artificial Intelligence, Data Mining & Machine Learning, Algorithm Analysis & Design, Database Systems, Computer Organization, Theory of Computation, Data Visualization, Methods in Data Analytics, and Applied Statistics.",
      "Honors: Dean's List (Spring 2022, Spring 2023), Florence Leas Sophomore Prize, Mortar Board National Honor Society, and the Golden Bishop Award for WCSA Best New Member."
    ],
    "related_projects": [],
    "links": [],
    "has_detail": true,
    "id": "2020-08-b-a-computer-science-data-analytics",
    "excerpt": "B.A. in Computer Science & Data Analytics with an Economics minor at Ohio Wesleyan University — four-year program completed in three years."
  },
  {
    "title": "Toward Vehicle-Agnostic Driving Signatures for Cognitive Impairment Prediction from Naturalistic Driving Data",
    "category": "research",
    "organization": "DRIVES Project, Washington University in St. Louis",
    "location": "St. Louis, Missouri, USA",
    "role_context": "Master's Thesis (Thesis Supervisor & Lab PI: Dr. Ganesh Babulal; Thesis Advisor & Committee Chair: Dr. Alvitta Ottley)",
    "start_date": "2025-08-01",
    "end_date": "2026-04-30",
    "responsibilities": [
      "Built an end-to-end pipeline processing 790,000 naturalistic driving trips (26,968 participant-weeks) from 304 older adults, deriving vehicle-agnostic weekly driving features and integrating demographic covariates to predict Clinical Dementia Rating (CDR) status.",
      "Benchmarked six model families (logistic regression, random forest, XGBoost, MLP, DANN, GRU-DANN) under leave-one-participant-out cross-validation; GRU-DANN achieved the highest participant-level ROC AUC (0.599) and balanced accuracy (0.584).",
      "Defended April 2026; published as no. 1341 in the McKelvey School of Engineering Graduate Student Theses & Dissertations."
    ],
    "related_projects": [],
    "links": [
      {
        "label": "Thesis — WashU Open Scholarship",
        "url": "https://openscholarship.wustl.edu/eng_etds/1341/",
        "type": "publication"
      }
    ],
    "has_detail": true,
    "id": "2025-08-toward-vehicle-agnostic-driving-signatures-for",
    "excerpt": "Master's thesis benchmarking six model families on 26,968 participant-weeks of naturalistic driving data from 304 older adults to predict cognitive impairment across vehicle types."
  },
  {
    "title": "Opinion Survey on Artificial Intelligence in the Workplace",
    "category": "research",
    "organization": "Ohio Wesleyan University",
    "location": "Delaware, Ohio, USA",
    "role_context": "Data Analytics Capstone — DATA 490 Independent Study (Mentor: Dr. Nicholas Dietrich)",
    "start_date": "2023-01-01",
    "end_date": "2023-05-31",
    "responsibilities": [
      "Designed and fielded a survey experiment on workplace attitudes toward AI, recruiting 250 employees in each of four industries (education, IT/STEM, retail, and healthcare) via Prolific with Qualtrics survey administration.",
      "Analyzed quantitative and qualitative responses using R and Tableau dashboards, finding consistently positive reported impacts of AI on efficiency and time savings across all four industries.",
      "Presented preliminary findings at Ohio Wesleyan's 2023 Spring Student Symposium."
    ],
    "related_projects": [],
    "links": [
      {
        "label": "Project repository",
        "url": "https://github.com/agopalareddy/ai-opinion-survey",
        "type": "github"
      }
    ],
    "has_detail": true,
    "id": "2023-01-opinion-survey-on-artificial-intelligence-in-the",
    "excerpt": "Designed and fielded a capstone survey experiment on workplace attitudes toward AI across four industries, analyzing 1,000 employee responses with R and Tableau."
  },
  {
    "title": "Artificial Intelligence in Modern Board Games - Lost Cities AI",
    "category": "research",
    "organization": "Ohio Wesleyan University",
    "location": "Delaware, Ohio, USA",
    "role_context": "Summer Science Research Program (Mentor: Dr. Sean McCulloch)",
    "start_date": "2022-05-01",
    "end_date": "2022-07-31",
    "responsibilities": [
      "Developed a complete digital version of the Lost Cities card game in Java within the first two weeks of the mentored summer research program.",
      "Designed an intelligent agent that uses mathematical heuristics to evaluate moves, winning over 70% of test games against human players.",
      "Presented the research at Ohio Wesleyan's Patricia Belt Conrades Summer Science Research Symposium."
    ],
    "related_projects": [],
    "links": [
      {
        "label": "Lost Cities AI demo",
        "url": "https://agreddy.com/lost-cities/",
        "type": "demo"
      },
      {
        "label": "Project repository",
        "url": "https://github.com/agopalareddy/LostCities",
        "type": "github"
      }
    ],
    "has_detail": true,
    "id": "2022-05-artificial-intelligence-in-modern-board-games-lost",
    "excerpt": "Built a digital Lost Cities card game in Java and a heuristic-driven AI agent that won over 70% of test games against human players during a mentored summer research program."
  },
  {
    "title": "Mobile Application Developer Intern",
    "category": "professional",
    "organization": "Ignite Performance Consulting",
    "location": "Remote",
    "role_context": null,
    "start_date": "2026-09-01",
    "end_date": null,
    "responsibilities": [
      "Own development and launch of the company's athlete coaching app, a React Native mobile client backed by a Next.js web platform, an Express/MongoDB API, and a Rasa chatbot.",
      "Work directly with the founder on product direction, delivering the remaining features, such as the daily check-in, to bring the mobile app level with the web platform.",
      "Modernized the mobile codebase and fixed security and cross-platform setup problems to get the app ready for production.",
      "Leading testing and release of the app on the Apple App Store and Google Play ahead of its planned October 2026 launch."
    ],
    "related_projects": [],
    "links": [],
    "has_detail": true,
    "id": "2026-09-mobile-application-developer-intern",
    "excerpt": "Building Ignite Performance Consulting's athlete coaching app, a React Native client on a Next.js, Express/MongoDB, and Rasa stack, and preparing its App Store and Google Play release."
  },
  {
    "title": "Graduate Assistant with the Taylor Family Center for Student Success",
    "category": "professional",
    "organization": "Washington University in St. Louis",
    "location": "St. Louis, Missouri, USA",
    "role_context": null,
    "start_date": "2025-11-01",
    "end_date": "2026-05-31",
    "responsibilities": [
      "Planned and organized student engagement events such as End of Week Unwind, supporting the center's mission of helping first-generation and limited-income (FLI) students thrive.",
      "Analyzed student engagement and survey data in compliance with FERPA, and developed process manuals establishing best practices for data evaluation in the department.",
      "Managed survey design, the center's website, weekly newsletter, and social media; represented the department at off-campus excursions and trips."
    ],
    "related_projects": [],
    "links": [
      {
        "label": "Taylor Family Center for Student Success",
        "url": "https://taylorfamilycenter.washu.edu/",
        "type": "organization"
      }
    ],
    "has_detail": true,
    "id": "2025-11-graduate-assistant-with-the-taylor-family-center",